{
  "systemname": "Movella XSens",
  "format": "mvnx",
  "abbrev":"XSens",
  "positions": "absolute",
  "rotations": "relative",
  "rotation-representation": "quaternion_xyzw",
  "fps": 60,
  "dim-order": [0,2,1],
  "scale":1,
  "joint-graph": [
    {
      "id": 0,
      "pid": -1,
      "name": "Pelvis"
    },
    {
      "id": 1,
      "pid": 0,
      "name": "jL5S1"
    },
    {
      "id": 2,
      "pid": 1,
      "name": "jL4L3"
    },
    {
      "id": 3,
      "pid": 2,
      "name": "jL1T12"
    },
    {
      "id": 4,
      "pid": 3,
      "name": "jT9T8"
    },
    {
      "id": 5,
      "pid": 4,
      "name": "jT1C7"
    },
    {
      "id": 6,
      "pid": 5,
      "name": "jC1Head"
    },
    {
      "id": 7,
      "pid": 4,
      "name": "jRightT4Shoulder"
    },
    {
      "id": 8,
      "pid": 7,
      "name": "jRightShoulder"
    },
    {
      "id": 9,
      "pid": 8,
      "name": "jRightElbow"
    },
    {
      "id": 10,
      "pid": 9,
      "name": "jRightWrist"
    },
    {
      "id": 11,
      "pid": 4,
      "name": "jLeftT4Shoulder"
    },
    {
      "id": 12,
      "pid": 11,
      "name": "jLeftShoulder"
    },
    {
      "id": 13,
      "pid": 12,
      "name": "jLeftElbow"
    },
    {
      "id": 14,
      "pid": 13,
      "name": "jLeftWrist"
    },
    {
      "id": 15,
      "pid": 0,
      "name": "jRightHip"
    },
    {
      "id": 16,
      "pid": 15,
      "name": "jRightKnee"
    },
    {
      "id": 17,
      "pid": 16,
      "name": "jRightAnkle"
    },
    {
      "id": 18,
      "pid": 17,
      "name": "jRightBallFoot"
    },
    {
      "id": 19,
      "pid": 0,
      "name": "jLeftHip"
    },
    {
      "id": 20,
      "pid": 19,
      "name": "jLeftKnee"
    },
    {
      "id": 21,
      "pid": 20,
      "name": "jLeftAnkle"
    },
    {
      "id": 22,
      "pid": 21,
      "name": "jLeftBallFoot"
    }
  ]
}